name;description;website;image_url;source_page;market;type;Location;Greater Stockholm Y/N
Fictive Reality AB;Fictive Reality utvecklar metaverse-baserade lösningar för lärande och rekrytering i immersiva virtuella miljöer. Företagets plattform använder virtual reality och deep tech för att skapa realistiska träningssimuleringar och interaktiva rekryteringsupplevelser. Fictive Reality möjliggör praktisk färdighetsträning i riskfria virtuella miljöer för yrken inom hälsovård, industri och service. Företaget erbjuder också VR-baserade bedömningsverktyg för att utvärdera kandidaters färdigheter i verklighetstrogna scenarier. Genom att kombinera gaming-teknologi med HR driver Fictive Reality innovation inom experiential learning.;https://www.fictivereality.com/;https://www.ai-startups-europe.eu/assets/images/landscape/_180x180_letterbox_center-center_90_none_ffffff_ns/4471822/recbgxK4miQUAFYPR.webp;https://www.ai-startups-europe.eu/p7?country%5B%5D=4000642;B2B;deep tech;Älvsjö, Sweden;No
Zentosa;Zentosa tillhandahåller kvalitetssäkrad träningsdata för maskininlärning och AI-projekt genom ett team av human-in-the-loop-experter. Företaget erbjuder pålitliga och trusted datasets för alla typer av use cases, från enkla till komplexa, genom att kontinuerligt träna, förbättra och utvärdera sin talangpool. Zentosa's beprövade leveransmodell ger kvalitetsdata i snabb takt och med skalbarhet, där den stora poolen av skicklig talang möjliggör uppskalning efter kundens behov. Företaget har djup erfarenhet från rekrytering och planering för många olika use cases. Zentosa kan hantera vilken mjukvara som helst som kunden använder och erbjuder flera säkra lösningar från on-premises till säkra remote contractors för att skydda kundens mest värdefulla tillgång - datan. Företaget är erkänt som Trusted Startup inom AI i Sverige och Europa av AI Sweden, Ignite Sweden och RISE, samt medlem i NVIDIA Inception Program. Zentosa hjälper maskininlärningsteam att fokusera på utveckling och deployment av AI-modeller medan Zentosa skapar datasets.;https://www.zentosa.se;https://www.ai-startups-europe.eu/assets/images/landscape/_180x180_letterbox_center-center_90_none_ffffff_ns/4472043/reckBbLH4U9Vzw1pG.webp;https://www.ai-startups-europe.eu/p21?country%5B%5D=4000642;B2B, enterprise software;artificial intelligence, machine learning;Bromma, Stockholm;Yes
Vectorview;Vectorview utvecklar en plattform för att utvärdera kapaciteten hos foundation models och LLM-agenter genom skräddarsydda evalueringsverktyg. Företaget, som är del av Y Combinator W24-batchen, fokuserar på att göra det enkelt att red team för säkerhet och benchmarka prestanda genom custom task evaluators. Vectorview adresserar utmaningen att förhindra oönskade beteenden i LLM:er genom att tillhandahålla målriktade utvärderingar för specifika, verkliga scenarier snarare än generella benchmarks som MMLU eller BBQ. Plattformen erbjuder automatisk red-teaming för att identifiera och mitigera risker tidigt i deployment-processen, samt möjlighet att bedöma genomförbarheten av use cases innan utveckling påbörjas. Vectorview genomför också kritiska tester för self-replicating AI-system och andra potentiella existentiella risker. Tjänsten används av företag som arbetar med LLM-agenter eller foundation models och behöver säkerställa att AI beter sig som avsett utan biased, offensivt eller okontrollerbart beteende.;https://www.vectorview.ai/;https://www.ai-startups-europe.eu/assets/images/landscape/_180x180_letterbox_center-center_90_none_ffffff_ns/4471059/rec7F72VNzRwjD3lW.webp;https://www.ai-startups-europe.eu/p20?country%5B%5D=4000642;B2B, enterprise software;artificial intelligence, saas;Bromma, Stockholm;Yes
Cocoon Airbag Protection AB;Cocoon Airbag Protection utvecklar världens första cykelbarnsäte med avancerad patenterad airbagteknik. Det svenska startupen adresserar problemet att traditionella cykelstolar inte erbjuder verkligt stötdämpskydd vid olyckor. Cocoons system använder smart krockdetektering som omedelbart aktiverar airbagen vid en olycka för att skydda barnets huvud, nacke och kropp. Den portabla airbagen fästs enkelt på cykelstolens inbyggda bas och kan tas med när man är klar. Produkten är designad av föräldrar för föräldrar med ambitionen att erbjuda samma säkerhet för andras barn som för sina egna. Säkerhetslösningen är utvecklad av säkerhetsexperter, bekväm att använda och byggd för dagligt bruk.;https://www.cocoonairbag.com/;https://www.ai-startups-europe.eu/assets/images/landscape/_180x180_letterbox_center-center_90_none_ffffff_ns/4471527/recOs8jOCGSxXN19x.webp;https://www.ai-startups-europe.eu/p4?country%5B%5D=4000642;B2B, enterprise software;artificial intelligence;Eskilstuna, Sweden;No
Paniax;Paniax demokratiserar datavetenskap genom att göra avancerade dataanalys- och AI-verktyg tillgängliga för ett bredare användarsegment. Företaget fokuserar på att förenkla komplexa dataprocesser och göra dem mer lättillgängliga för organisationer som vill implementera AI och maskininlärning utan omfattande teknisk expertis. Paniax utvecklar lösningar inom forskning och utveckling som hjälper företag att utvinna värde från sina data genom användarvänliga gränssnitt och automatiserade arbetsflöden.;https://www.paniax.com;https://www.ai-startups-europe.eu/assets/images/landscape/_180x180_letterbox_center-center_90_none_ffffff_ns/4471302/recGob8UwuxmAgNTG.webp;https://www.ai-startups-europe.eu/p15?country%5B%5D=4000642;B2B, enterprise software;artificial intelligence, machine learning;Falköping, Sweden;No
CADcog;CADcog är en XR-plattform för att skapa inkluderande och tillgängliga produkter genom virtuell och förstärkt verklighet. Verktyget möjliggör interaktion med CAD-modeller som om de vore fysiska prototyper, vilket hjälper företag identifiera användbarhetsproblem och tillgänglighetshinder tidigt i utvecklingsprocessen. Detta leder till snabbare designiterationer, reducerade kostnader och effektivare arbetsflöden. CADcog integreras sömlöst i befintliga processer och säkerställer att produkter inte bara är användarvänliga utan också tillgängliga för en bredare publik. Plattformen är säker, enkel att använda och byggd för att stödja organisationer i att förfina sina designprocesser samtidigt som tillgänglighetsstandarder uppfylls.;https://www.cadcog.com/;https://www.ai-startups-europe.eu/assets/images/landscape/_180x180_letterbox_center-center_90_none_ffffff_ns/4472334/recvvQH3ZXn3Zv7O4.webp;https://www.ai-startups-europe.eu/p3?country%5B%5D=4000642;B2B, enterprise software;saas;Gävle, Sweden;Nej
RoPhi AB;RoPhi arbetar med Industrial Edge Computing IoT och Robotics. Företaget utvecklar lösningar för edge computing i industriella miljöer där data bearbetas lokalt vid källan istället för att skickas till molnet. Detta är särskilt värdefullt för robotik- och IoT-applikationer där låg latens och hög tillförlitlighet är kritiskt. RoPhi:s teknologi möjliggör intelligent databearbetning i realtid direkt på produktionsgolvet, vilket förbättrar prestanda och minskar beroendet av internetanslutning för kritiska industriella processer.;https://rophi.se/;https://www.ai-startups-europe.eu/assets/images/landscape/_180x180_letterbox_center-center_90_none_ffffff_ns/4471300/recGiEtNBvLMJPg1O.webp;https://www.ai-startups-europe.eu/p17?country%5B%5D=4000642;B2B, enterprise software;iot internetofthings;Göteborg, Sweden;No
Algeno;Algeno erbjuder AI-styrd optimering av värmesystem för stora fastighetsbestånd, med målet att sänka uppvärmningskostnader samtidigt som ett stabilt och förutsägbart inomhusklimat säkerställs. Företagets tjänst kopplar samman temperatursensorer med AI som integrerar väderdata, information från fastighetens interna system och dygnstid för att proaktivt reglera värmen innan temperatur- och vädersvängningar inträffar. Systemet ger fastighetsägare full kontroll och rådighet över alla inställningar med realtidsdata tillgänglig för drifttekniker. Eftersom uppvärmning utgör den största delen av en fastighets årliga klimatavtryck och driftskostnad, kan Algenos lösning markant minska både utsläpp och kostnader genom effektivare energianvändning och reducerade maxeffekter. Tekniken har kort återbetalningstid och lär sig automatiskt anpassa sig till förändringar som fönsterbyten eller tilläggsisolering.;https://algeno.se/;https://www.ai-startups-europe.eu/assets/images/landscape/_180x180_letterbox_center-center_90_none_ffffff_ns/4472097/recmXiMLkRy5L5CgC.webp;https://www.ai-startups-europe.eu/?country%5B%5D=4000642;B2B, energy, real estate;artificial intelligence, iot internetofthings, subscription;Göteborg, Sweden;No
Kluero;Kluero erbjuder en AI-baserad lösning för att optimera och förutsäga teamdynamik i organisationer. Företaget utvecklar verktyg för att analysera och förbättra teamarbete med en tidigare ouppnådd detaljnivå. Klueros teknologi kombinerar matematik, psykologi och datavetenskap för att hjälpa team förstå sina interna dynamiker, förbättra samarbetet och till och med förutsäga hur teamet effektivt kan expanderas. Forskning visar att upp till 65% av alla startups som misslyckas gör det på grund av dålig teamdynamik, vilket gör Kluero till ett viktigt verktyg för att förebygga teamrelaterade misslyckanden. Lösningen är särskilt användbar för startup-teams, rekrytering, onboarding och due diligence i VC- och M&A-processer. Kluero använder en modern interaktionsdriven analys istället för traditionella komponentdrivna metoder.;https://kluero.com/;https://www.ai-startups-europe.eu/assets/images/landscape/_180x180_letterbox_center-center_90_none_ffffff_ns/4472360/recxDEQfdhrVpezwa.webp;https://www.ai-startups-europe.eu/p10?country%5B%5D=4000642;B2B, enterprise software;artificial intelligence;Göteborg, Sweden;No
Kognic;Kognic utvecklar den ledande annotationsplattformen för sensor-fusion som används av globala aktörer för att accelerera utvecklingen av Embodied AI. Företaget tillhandahåller avancerade verktyg för att annotera och strukturera komplexa sensordata från kameror, lidar och andra sensorer som används i autonoma fordon och robotsystem. Kognics plattform möjliggör effektiv skapandet av högkvalitativa träningsdataset för maskininlärning med funktioner som auto-label co-pilot som kan spara upp till 68% av tiden för annotering. Plattformen stödjer hela pipelinen från import, annotering och verifiering till export av data. Kognic betjänar ledande företag som Zenseact, Qualcomm, Continental, Bosch, Volvo Group och Kodiak Robotics. Lösningen erbjuds både som annoterade dataset med managed workforce och som plattformslicenser för interna team.;https://www.kognic.com/;https://www.ai-startups-europe.eu/assets/images/landscape/_180x180_letterbox_center-center_90_none_ffffff_ns/4471479/recN8ESbFw4AKXaHL.webp;https://www.ai-startups-europe.eu/p10?country%5B%5D=4000642;B2B, B2C, enterprise software;artificial intelligence, machine learning, saas;Göteborg, Sweden;No
Lucero;Lucero ger varje biolog i världen verktygen för att manipulera och analysera enskilda celler. Företaget utvecklar avancerad teknologi för single-cell analys som möjliggör djupare förståelse av cellbiologi och sjukdomsmekanismer. Genom att demokratisera tillgången till verktyg för single-cell manipulation öppnar Lucero upp nya möjligheter för forskning inom biomedicin, läkemedelsutveckling och personlig medicin. Teknologin är särskilt värdefull för forskare som arbetar med komplex cellbiologi där förståelse på enskild cellnivå är avgörande.;https://lucerobio.com;https://www.ai-startups-europe.eu/assets/images/landscape/_180x180_letterbox_center-center_90_none_ffffff_ns/4472289/recuLr3ITSH8kqryE.webp;https://www.ai-startups-europe.eu/p11?country%5B%5D=4000642;B2B, pharmaceutical, biotechnology;deep tech;Göteborg, Sweden;No
Monava AB;Monava övervakar naturkatastrofer i alpina miljöer med mottot 'seeing sound - air, ground, water'. Företaget utvecklar AI-baserade lösningar för att detektera och övervaka naturhazarder som laviner, jordskred och andra geofysiska händelser i bergsområden. Genom att kombinera sensorteknologi med avancerad dataanalys och AI kan Monava ge tidig varning och bättre förståelse för naturkatastrofer, vilket bidrar till ökad säkerhet för människor och infrastruktur i alpina regioner.;https://monava.io;https://www.ai-startups-europe.eu/assets/images/landscape/_180x180_letterbox_center-center_90_none_ffffff_ns/4471974/rechXnWQSjeAbO9HN.webp;https://www.ai-startups-europe.eu/p13?country%5B%5D=4000642;B2B, enterprise software;artificial intelligence, iot internetofthings;Göteborg, Sweden;No
OneTwo Analytics AB;OneTwo Analytics erbjuder AI/ML-baserade tjänster för att förbättra diabetesvård. Företaget utvecklar lösningar som hjälper både patienter och vårdpersonal att bättre förstå och hantera diabetes genom dataanalys och maskininlärning. OneTwo Analytics fokuserar på att använda patientdata för att ge personaliserade insikter och rekommendationer som kan förbättra behandlingsresultat och livskvalitet för personer med diabetes. Lösningarna är särskilt värdefulla för att optimera insulinbehandling och förebygga komplikationer.;https://www.onetwo-analytics.com;https://www.ai-startups-europe.eu/assets/images/landscape/_180x180_letterbox_center-center_90_none_ffffff_ns/4470913/rec0kxESANtKPa5Fp.webp;https://www.ai-startups-europe.eu/p14?country%5B%5D=4000642;B2B, B2C, health;artificial intelligence, machine learning;Göteborg, Sweden;No
Parametric Solutions AB;Parametric Solutions genererar hundratals byggkoncept på sekunder med hjälp av algoritmer. Företaget har utvecklat Hektar, ett augmented drafting-verktyg för tidigt stadsplaneringsarbete som effektiviserar designprocessen genom att hantera komplexitet och automatisera monotona, tidskrävande uppgifter, vilket ger arkitekter mer tid för design. Stadsplanering är notoriskt utmanande och omfattar flera skalor från mikro till makro, där korsreferenser av alla möjliga val och utfall snabbt blir överväldigande. Hektar ger en omfattande översikt av alternativ för att hitta vägen framåt. Riskvärdering kräver rätt information vid rätt tidpunkt, och Hektar utvecklades som ett transparent och omfattande verktyg för beslutsfattande baserat på relevant data, så tidigt som möjligt. Alla byggtypologier - lameller, radhus, kvarter eller villor - kommer med distinkta regeluppsättningar som är beroende av andra aspekter av stadsstrukturen. Dessa regeluppsättningar har avkodats och införlivats i Hektar för att stödja designprocessen.;https://www.parametric.se;https://www.ai-startups-europe.eu/assets/images/landscape/_180x180_letterbox_center-center_90_none_ffffff_ns/4471196/recD7pJHGw9C4tY5r.webp;https://www.ai-startups-europe.eu/p15?country%5B%5D=4000642;B2B;deep tech;Göteborg, Sweden;No
Pirr AB;Pirr är en AI-driven berättarplattform där användare skapar sina egna kärlekshistorier genom co-creation med AI. Plattformen låter användare leva berättelserna, inte bara läsa dem, genom att forma romantiska noveller precis som de vill ha dem - från slow-burn romance och heart-fluttering moments till dramatiska vändningar. Pirr är helt gratis att utforska och njuta av just nu, med möjlighet till premium features i framtiden. Användare kan anpassa karaktärer genom att välja namn, pronomen och personligheter, samt sätta ton och atmosfär genom genre, vibes, plot, plats och tema. Appen erbjuder NSFW-läge för användare över 18 år inom ramen för innehållsriktlinjer. Pirr möjliggör även samarbete där användare kan bjuda in andra att co-create berättelser. Alla berättelser är privata som standard och användare har full kontroll över synlighet. Plattformen använder robust säkerhet för att skydda integritet och all information hålls anonym. Pirr är tillgängligt via mobil-app och web browser (beta).;https://www.pirr.me/;https://www.ai-startups-europe.eu/assets/images/landscape/_180x180_letterbox_center-center_90_none_ffffff_ns/4472434/reczob340FxFuzaA7.webp;https://www.ai-startups-europe.eu/p15?country%5B%5D=4000642;B2C, enterprise software;artificial intelligence, saas;Göteborg, Sweden;No
Rebl Industries AB;Rebl Industries omformar robotautomation med sitt motto 'the future of staffing with the next generation of robotics'. Företaget erbjuder robotautomation as-a-service där kunder betalar för effekten, inte för roboten, mjukvara, säkerhetscertifiering eller projektledning. Med Rebls resultatbaserade kostnadsmodell får företag robotautomation utan större investeringar. Rebls Workmates utför jobb som anses farliga och tröttande samtidigt som de förbättrar effektivitet, kvalitet och precision. Tidigare var robotautomation endast tillgängligt för större företag, men med Rebl Industries är det nu tillgängligt för alla företag i alla industrier. Rebl fokuserar på att transformera industrier genom att göra avancerad robotik mer demokratisk och ekonomiskt åtkomlig.;https://www.rebl.se;https://www.ai-startups-europe.eu/assets/images/landscape/_180x180_letterbox_center-center_90_none_ffffff_ns/4472147/recoUNsUhftoZ5hZl.webp;https://www.ai-startups-europe.eu/p16?country%5B%5D=4000642;B2B;deep tech;Göteborg, Sweden;No
Repli5;Repli5 specialiserar sig på automatiserad generering av syntetisk data och digitala tvillingar för computer vision. Företaget utvecklar precisionshanterade träningsdataset drivna av proprietär generativ AI-teknologi för automotive AD/ADAS, industriell robotik och försvarssektorer. Repli5 banbrytande generativa modeller kan användas för att skapa optimala dataset för att träna perceptionssystem, vilket möjliggör robusta computer vision-modeller i snabbare takt och till lägre kostnader. För automotive-applikationer möjliggör Repli5 träning av perceptionssystem med höga proportioner syntetisk data, särskilt för edge cases och scenarion med otillräcklig träningsdata från verkligheten, som lane keeping och automated parking. För industriell robotik kan teamet skapa syntetisk data från CAD-filer och augmentera med diffusion-baserad teknologi RealSim för att skapa högst realistiska dataset för robotikträning i Smart Factory-applikationer. Inom försvar kan Repli5 träna försvarssystem med delvis-syntetisk data där verklig träningsdata är begränsad i volym eller helt otillgänglig.;https://www.repli5.com/;https://www.ai-startups-europe.eu/assets/images/landscape/_180x180_letterbox_center-center_90_none_ffffff_ns/4472432/reczmVhUxjKWZaBCw.webp;https://www.ai-startups-europe.eu/p16?country%5B%5D=4000642;B2B, enterprise software;artificial intelligence;Göteborg, Sweden;No
ANYO Labs;ANYO Labs utvecklar AI-lösningar för läkemedelsutveckling med fokus på att accelerera och förbättra drug discovery-processen. Företaget tillämpar avancerad maskininlärning och dataanalys för att identifiera nya läkemedelskandidater och optimera molekyldesign. Genom att kombinera artificiell intelligens med farmakologisk expertis strävar ANYO Labs efter att minska både tid och kostnad i den tidskrävande processen att ta fram nya läkemedel, samtidigt som träffsäkerheten i att hitta lovande substanser ökar.;https://www.anyolabs.com/;https://www.ai-startups-europe.eu/assets/images/landscape/_180x180_letterbox_center-center_90_none_ffffff_ns/4472229/recs6Iz0P3Vy9waNc.webp;https://www.ai-startups-europe.eu/p2?country%5B%5D=4000642;B2B, B2C, pharmaceutical, biotechnology;artificial intelligence, machine learning, deep tech;Göteborg, Sweden;No
Unbiased;Unbiased utvecklar en transparent och pålitlig träningsdataplattform för AI. Företaget fokuserar på att tillhandahålla högkvalitativa och etiskt hanterade dataset för träning av maskininlärningsmodeller. Genom att säkerställa transparens i datakällor och processer hjälper Unbiased organisationer att bygga AI-system som är mer rättvisa och tillförlitliga, samtidigt som man adresserar viktiga frågor kring bias och representation i träningsdata.;https://unbiased.ml;https://www.ai-startups-europe.eu/assets/images/landscape/_180x180_letterbox_center-center_90_none_ffffff_ns/4471384/recJNAWJlt2N2lTe6.webp;https://www.ai-startups-europe.eu/p20?country%5B%5D=4000642;B2B, enterprise software;artificial intelligence, machine learning, saas;Göteborg, Sweden;No
Utilifeed AB;Utilifeed tillhandahåller intelligenta webbaserade tjänster för fjärrvärmebolag och fastighetsägare. Företaget kombinerar industriell expertis med modern IT-infrastruktur och dataanalys för att skapa användarvänliga men kraftfulla verktyg som möjliggör ökad resursutnyttjande, förbättrade kundrelationer och minskat miljöavtryck. Utilifeed fokuserar på att digitalisera fjärrvärmesektorn och hjälpa den att maximera sin potential att fånga spillvärme och använda den effektivt för uppvärmning av byggnader. Lösningarna bidrar till radikala besparingar för både miljö och plånbok genom ökad effektivitet, flexibilitet och sömlös integration med slutanvändaren för förbättrade kundrelationer.;https://utilifeed.com/;https://www.ai-startups-europe.eu/assets/images/landscape/_180x180_letterbox_center-center_90_none_ffffff_ns/4471262/recFYIJGm9u5kCJWQ.webp;https://www.ai-startups-europe.eu/p20?country%5B%5D=4000642;B2B, B2C, energy, real estate;artificial intelligence;Göteborg, Sweden;No
Viking Analytics AB;Viking Analytics bygger AI-baserade predictive maintenance-applikationer för industriella tillgångar. Företagets flaggskeppsprodukt MultiViz 2.0 använder AI för att filtrera bort falska alarm och notification fatigue genom att endast lyfta fram vad som verkligen behöver uppmärksamhet. Systemet integrerar med befintliga sensor-setups och hjälper team att skala predictive maintenance-operationer över hela anläggningar och fabriker utan att byta hårdvara eller ändra arbetsflöden. MultiViz fungerar som ett andra par ögon genom att använda AI för att flagga symtom som ovanlig modulation, stigande kurtosis och subtila harmoniska skift. Genom att lära sig vad som är 'normalt' för varje enskild sensor kan systemet detektera problem tidigt innan tröskelvärden överskrids eller kostsamma haverier inträffar. Plattformen reducerar falska alarm med 95%, lär sig hur varje tillgång beter sig utan att kräva failure history, och ger varje alert med kontext inklusive spectrum shifts och pattern deviations. Viking Analytics används av branschledare globalt och integrerar med 50+ vibrationssensorer och gateways via MQTT.;https://www.vikinganalytics.se;https://www.ai-startups-europe.eu/assets/images/landscape/_180x180_letterbox_center-center_90_none_ffffff_ns/4471389/recJYNTMArauwdJZU.webp;https://www.ai-startups-europe.eu/p21?country%5B%5D=4000642;B2B, enterprise software;artificial intelligence, hardware, deep tech;Göteborg, Sweden;No
Bazaro;Bazaro tillhandahåller autonom fakturahantering genom AI som eliminerar manuella processer inom ekonomiadministration. Företagets SaaS-lösning automatiserar hela fakturacykeln från mottagning till betalning, vilket frigör tid för ekonomiteam att fokusera på strategiskt arbete istället för repetitiva uppgifter. Plattformen integreras med befintliga ERP-system och använder maskininlärning för att hantera fakturaflöden intelligent och effektivt.;https://bazaro.io/;https://www.ai-startups-europe.eu/assets/images/landscape/_180x180_letterbox_center-center_90_none_ffffff_ns/4471695/recWQQy4cPv0OnW3c.webp;https://www.ai-startups-europe.eu/p3?country%5B%5D=4000642;B2B, fintech, payments;artificial intelligence, machine learning, saas;Göteborg, Sweden;No
CELLINK;CELLINK skapar framtidens medicin genom att tillhandahålla teknologier, produkter och tjänster för att skapa, förstå och bemästra biologi. Företaget är ledande inom 3D-bioprinting och erbjuder prisbelönta 3D-bioprintrar som BIO X, BIO X6, LUMEN X och BIONOVA X tillsammans med noggrant utvald biomaterial och bioinks. CELLINK möjliggör additiv tillverkning med celler och biomaterial för att skapa organliknande strukturer där levande celler kan föröka sig. Tekniken används inom personaliserad medicin, läkemedelsutveckling, regenerativ medicin och cellodlad mat. Företagets produkter används av branschledare världen över för att accelerera forskning inom kritiska områden och revolutionera vårdsektorn genom att möjliggöra patientspecifika modeller, höggenomströmningsbiofabrikation och mer fysiologiskt relevanta modeller.;https://www.cellink.com;https://www.ai-startups-europe.eu/assets/images/landscape/_180x180_letterbox_center-center_90_none_ffffff_ns/4471068/rec7WrksNpUmzraWN.webp;https://www.ai-startups-europe.eu/p3?country%5B%5D=4000642;B2B, health, pharmaceutical, biotechnology, food;deep tech;Göteborg, Sweden;No
