name;description;website;image_url;source_page;market;type;Location;Greater Stockholm Y/N
United Robots AB;United Robots automatiserar innehållsskapande för medieföretag och marknadsförare genom AI-driven nyhetsgenerering. Företaget har som mission att stärka lokala nyhetsutgivare genom att hjälpa redaktioner frigöra reportertid, expandera bevakningen och växa affären. United Robots tillhandahåller rutinmässig rapportering baserad på strukturerad data inom områden som sport, fastighetsförsäljning, företagsregistreringar, trafikincidenter och väder. Lösningen möjliggör bevakning av tusentals lokala evenemang där det tidigare inte fanns resurser - exempelvis alla lokala fotbollsmatcher eller fastighetsförsäljningar. Tjänsten används av ledande förlag som Mediahuis, McClatchy, Schibsted, Bonnier, Advance Local och DPG Media. Utgivare rapporterar att automatiserat innehåll driver både räckvidd och digitala prenumerationer genom att täcka fler ämnen, över fler geografier, och nå fler läsare med relevant innehåll - utan påverkan på journalisternas tid. United Robots är medlem i WAN-IFRA, INMA, Local Media Association och Americas Newspapers.;https://www.unitedrobots.ai;https://www.ai-startups-europe.eu/assets/images/landscape/_180x180_letterbox_center-center_90_none_ffffff_ns/4472353/recwuZVs82hBOxJOJ.webp;https://www.ai-startups-europe.eu/p20?country%5B%5D=4000642;B2B, B2C, enterprise software;artificial intelligence, subscription;Lidköping, Sweden;No
SeaPattern;SeaPattern utvecklar data och AI för hållbart vattenbruk samt vattenkraft för en Net Zero-framtid. Det svenska hydropower-startupet tillkännagav i september 2025 att de säkrat €5 miljoner (50 miljoner SEK) i privat finansiering för att stödja framtida verksamhet och tillväxt. SeaPattern har beviljats finansiering från Vinnova och Försvarsmakten som en del av Innovation Program for Civil-Military Synergies, inspirerat av NATO:s accelerationsprogram DIANA. Företaget firar Global Hydropower Day den 11 oktober och är stolta över att bidra till den globala energiomställningen genom sin innovativa hydrokinetisteknologi. SeaPattern kombinerar operations-fokus inom både vattenbruk och förnybar energi med avancerad AI och dataanalys för att optimera produktionen och hållbarheten i dessa sektorer.;https://www.seapattern.com;https://www.ai-startups-europe.eu/assets/images/landscape/_180x180_letterbox_center-center_90_none_ffffff_ns/4471988/rechuOUih06SWyusE.webp;https://www.ai-startups-europe.eu/p17?country%5B%5D=4000642;B2B, B2C, fintech;artificial intelligence;Linköping;No
AgriOpt AB;AgriOpt är ett agtech-konsultbolag specialiserat på att göra AI, digitalisering och autonoma teknologier tillgängliga för lantbrukare. Företaget grundades av Isak Nielsen med visionen att alla jordbrukare ska kunna dra nytta av modern teknologi. Under startåren utvecklade AgriOpt den prisbelönta precisionsjordbruksplattformen Freja för datainsamling och AI-analys inom växtodling. Idag fokuserar bolaget på långsiktiga kundrelationer genom utbildning, konsulttjänster och sitt Agtech-nyhetsbrev, där de kombinerar expertis inom teknologi, agronomiska och gårdsspecifika förutsättningar. AgriOpt hjälper både jordbrukare i den digitala omställningen och agtech-företag med affärs- och produktutveckling för att skapa mer användarvänliga lösningar.;https://www.agriopt.com;https://www.ai-startups-europe.eu/assets/images/landscape/_180x180_letterbox_center-center_90_none_ffffff_ns/4472336/recw1qIuPw9Ej4V3w.webp;https://www.ai-startups-europe.eu/?country%5B%5D=4000642;B2B, B2C, agritech, edtech & e-learning;artificial intelligence, saas;Linköping, Sweden;No
Nibela AB;Nibela hjälper användare att hantera sin elförbrukning vilket resulterar i låga elkostnader. Genom revolutionerande AI får användare möjlighet att styra sin elförbrukning till dagar och timmar då elen är som billigast. Nibela erbjuder flexibla priser baserade på Nord Pools timspotpris och visar elpriset för hela kommande veckan. Appen ger insikter, analyser och tips för att minska elförbrukningen och möjliggör effektiv planering av veckans elanvändning. Användare får styrning och planering av enheter direkt i appen, tips om tider då elen är billigast, varningar vid onödig och hög elanvändning samt detaljerad förbrukningsöversikt. Nibelas AI-lösning lär sig och optimerar utifrån användarens förutsättningar. Smart schemaläggning gör att tvättmaskiner och elbilar kan startas automatiskt när elen är billigast, och systemet pausar automatiskt laddning vid höga priser. Nibela hjälper även användare att sätta och hålla månadsbudget med notiser som styr förbrukningen.;https://nibela.se;https://www.ai-startups-europe.eu/assets/images/landscape/_180x180_letterbox_center-center_90_none_ffffff_ns/4472299/recuadj5XigVclSwa.webp;https://www.ai-startups-europe.eu/p13?country%5B%5D=4000642;B2B, enterprise software;artificial intelligence;Linköping, Sweden;No
Arboair;Arboair fusionerar teknologi med naturvård genom att erbjuda AI-driven flygbildsanalys för skogsindustrin och urban grönytesförvaltning. Företaget kartlägger städer och skogar med högupplösta flygbilder på timmar istället för veckor, vilket skär inspektionskostnader med upp till 90%. Tekniken levererar träd-för-träd-data om art, hälsa och risker genom automatiserad digital skogsinventering, vilket möjliggör tidig problemdetektering, noggrann avverkningsplanering och faktabaserad riskhantering. För urbana miljöer möjliggör lösningen 3-30-300-compliance och stödjer trädskötselsplanering, budgetallokering och prioritering av nyplanteringar baserat på faktaunderlag. Arboair ersätter långsamma fältundersökningar med snabb flygövervakning, vilket sparar tid, minskar slöseri och ökar lönsamheten för både skogs- och stadsmiljöförvaltning.;https://www.arboair.com;https://www.ai-startups-europe.eu/assets/images/landscape/_180x180_letterbox_center-center_90_none_ffffff_ns/4472065/reckuR7EoUghUC8iW.webp;https://www.ai-startups-europe.eu/p2?country%5B%5D=4000642;B2B, agritech;artificial intelligence, deep tech;Linköping, Sweden;No
Dyno Robotics AB;Dyno Robotics utvecklar AI och robotiklösningar med fokus på datorseende som gör det möjligt för robotar att uppfatta sin omgivning på samma sätt som människor. Företaget arbetar med att skapa robotteknologi anpassad för mänskliga behov genom att kombinera avancerad datorseende-AI med praktiska robotapplikationer. Dyno Robotics teknologi möjliggör för robotar att förstå och navigera i komplexa miljöer, vilket öppnar för automation i situationer som tidigare krävt mänsklig visuell förståelse.;https://www.dynorobotics.se/;https://www.ai-startups-europe.eu/assets/images/landscape/_180x180_letterbox_center-center_90_none_ffffff_ns/4471081/rec8I7ltIPcWvGOQI.webp;https://www.ai-startups-europe.eu/p5?country%5B%5D=4000642;B2B, enterprise software;artificial intelligence;Linköping, Sweden;No
ENVISTA AB;ENVISTA bygger energifaktfullhet genom att tillhandahålla transparent och verifierbar data om byggnaders energiprestanda. Företagets deep tech-plattform kombinerar sensorer, dataanalys och AI för att ge fastighetsägare exakt insikt i energianvändning och optimeringsmöjligheter. ENVISTA hjälper företag att uppnå energieffektivitetsmål, reducera koldioxidavtryck och spara kostnader genom evidensbaserade åtgärder. Lösningen används av fastighetsutvecklare och förvaltare för att driva hållbar byggnadsförvaltning. Företaget bidrar till byggbranschens klimatomställning genom datadrivet beslutsfattande.;https://www.envista.se;https://www.ai-startups-europe.eu/assets/images/landscape/_180x180_letterbox_center-center_90_none_ffffff_ns/4472436/reczqIPkmaa2LM2IU.webp;https://www.ai-startups-europe.eu/p7?country%5B%5D=4000642;B2B;deep tech;Linköping, Sweden;No
iMatrics AB;iMatrics levererar AI-lösningar specifikt utvecklade för medieindustrin, med fokus på innehållsoptimering och audience analytics. Företagets plattform använder artificiell intelligens för att analysera läsarbeteende, förutsäga innehållsprestanda och optimera publiceringsstrategier. iMatrics hjälper publishers att öka engagemang, retention och intäkter genom datadriven innehållsstrategi. Lösningen används av tidningar, magasin och digitala medier för att förstå vad deras publik vill läsa. Genom att tillämpa AI på redaktionella beslut driver iMatrics mer effektiv och relevant journalistik.;https://www.imatrics.com;https://www.ai-startups-europe.eu/assets/images/landscape/_180x180_letterbox_center-center_90_none_ffffff_ns/4471738/recYAAvSFdQpFm1zx.webp;https://www.ai-startups-europe.eu/p9?country%5B%5D=4000642;B2B;artificial intelligence;Linköping, Sweden;No
CyStellar;CyStellar levererar geospatial intelligens för omfattande riskbedömning genom sin SaaS-plattform CyStellar TerraRisk Re, specifikt utvecklad för försäkringsindustrin. Företaget kombinerar satellitdata, AI och jordob servationsexpertis för att transformera riskbedömning och skadeutredning. Plattformen integrerar data från multipla källor inklusive satellitbilder, väderprognoser och miljöövervakning för att leverera realtidsbilder av riskfaktorer. TerraRisk Re möjliggör övervakning av exponering och realtidsbedömning av naturkatastrofer, med AI-drivna riskpoängsystem som kombinerar flera riskmodeller för precision i underwriting och portföljhantering. Lösningen kan reducera skadehanteringstiden med upp till 70% genom snabb fjärranalys av skador, minska bedrägerier genom satellitbaserad skadebedömning och minimera behovet av fysiska inspektioner. CyStellar erbjuder flexibla API-integrationer (Hazards API, Claims API, NatCat API) och stödjer ESG-rapportering, klimatriskbedömning och regulatorisk compliance.;https://www.cystellar.com;https://www.ai-startups-europe.eu/assets/images/landscape/_180x180_letterbox_center-center_90_none_ffffff_ns/4471962/rech6sJoi60b2c22P.webp;https://www.ai-startups-europe.eu/p4?country%5B%5D=4000642;B2B, space;artificial intelligence, saas;Linköping, Sweden;Nej
Lotus Field Analytics AB;Lotus Field Analytics utvecklar lösningar för finanssektorn som hjälper företag att skapa mening ur komplexa och ostrukturerade data. Med mottot 'We make sense out of chaos' fokuserar företaget på att använda avancerad dataanalys och AI för att ge finansiella institutioner bättre beslutsunderlag och operationell effektivitet. Lösningarna är särskilt användbara för att hantera stora datamängder och extrahera värdefulla insikter som kan förbättra verksamheten.;https://lotusfield.ai;https://www.ai-startups-europe.eu/assets/images/landscape/_180x180_letterbox_center-center_90_none_ffffff_ns/4472255/rectDWJmFU4afj0sd.webp;https://www.ai-startups-europe.eu/p11?country%5B%5D=4000642;B2B, enterprise software;artificial intelligence, big data;Luleå, Sweden;No
Inceptron;Inceptron möjliggör AI-adoption genom skräddarsydda och prisvärda lösningar för företag i alla storlekar. Företaget erbjuder konsulting, implementation och utveckling av AI-applikationer anpassade efter kundens specifika behov och budget. Inceptron fokuserar på att göra AI tillgängligt för mindre företag genom att minska komplexitet och kostnad. Tjänsterna inkluderar allt från initiala AI-strategier till fullskalig systemintegration och träning. Genom att demokratisera AI-teknologi driver Inceptron bredare digital transformation i näringslivet.;https://www.inceptron.io/;https://www.ai-startups-europe.eu/assets/images/landscape/_180x180_letterbox_center-center_90_none_ffffff_ns/4470926/rec1MsawWQMuWY0HD.webp;https://www.ai-startups-europe.eu/p9?country%5B%5D=4000642;B2B;artificial intelligence;Lund, Sweden;No
Lightbringer;Lightbringer automatiserar patentprocessen och gör det möjligt för teknikföretag att skydda sina innovationer snabbare och billigare. Företagets AI-drivna plattform kombinerar avancerad teknologi med expertpatentadvokater för att minska tiden för patentansökningar med upp till 70% och kostnaderna med upp till 50%. Lightbringer erbjuder transparenta, fasta priser och flexibla prenumerationsmodeller som växer med företagets behov. Plattformen guidar användare genom hela processen från att beskriva sin innovation med AI-verktyg, via matchning med erfarna patentadvokater, till inlämning inom några dagar. Efter patenteringen ger plattformen strategiska insikter om både den egna patentportföljen och konkurrenters patent. Lightbringer har sedan 2023 hjälpt över 1000 teknikgrundare att skydda sina innovationer och har uppnått 95% framgångsgrad för patent som lämnas in inom 30 dagar.;https://www.lightbringer.com/;https://www.ai-startups-europe.eu/assets/images/landscape/_180x180_letterbox_center-center_90_none_ffffff_ns/4471256/recFS4ldhE4wQ20eo.webp;https://www.ai-startups-europe.eu/p11?country%5B%5D=4000642;B2B, B2C, enterprise software;artificial intelligence, saas, subscription;Lund, Sweden;No
My Telescope;My Telescope är en AI-driven marknadsundersökningsplattform som analyserar och förutspår marknadsnachfrågan för att identifiera risker och skapa informerade planer. Plattformen erbjuder tillgång till MyTelescope Index som samlar komplett data från Google, Amazon, TikTok, YouTube, Pinterest och fler källor för att visa vad som verkligen trendar överallt. Till skillnad från Google Trends och AI-chatbots kan användare spara dashboards för att följa trender över tid och bygga kunskapsbaser. Plattformen är designad för att vara enkel att använda med tydliga visualiseringar och handlingsbara rekommendationer på vad man ska göra med insikterna. LLM-chatten med kontext låter användare ställa frågor om sparade trender och få svar baserade på multipla datakällor. My Telescope hjälper användare att upptäcka möjligheter tidigt och agera med förtroende genom att följa upp till 30+ topics och jämföra trender över tid. Plattformen används för allt från marknadsstudier och investeringar till brand tracking och content creation.;https://mytelescope.io/;https://www.ai-startups-europe.eu/assets/images/landscape/_180x180_letterbox_center-center_90_none_ffffff_ns/4472401/recyKsFGrVnBqtl4g.webp;https://www.ai-startups-europe.eu/p13?country%5B%5D=4000642;B2B, enterprise software;artificial intelligence, saas;Lund, Sweden;No
NFA Nordic Forestry Automation;Nordic Forestry Automation realiserar precisionsskogsbruk genom digitala verktyg och automation. Företagets kärnteknik är ett retrofit-system som gör det möjligt för skogsmaskiner att kontinuerligt bygga en digital representation av miljön omkring dem. Detta är en plattformsteknologi med bred användning inom precisionsskogsbruk, från inventering och beslutsstöd till avancerad maskinautomation. NFA:s första produkt är ett avancerat förarstödsystem för skördare som stödjer föraren genom förbättrad situationsmedvetenhet och tydlig visualisering av framsteg mot skördemål. Systemet erbjuder centimeternoggrann lokalisering av träd och maskin, robust mot korta GNSS-avbrott, exakt detektering och DBH-mätning av enskilda träd samt en robust sensorstack med Lidar, GNSS, RGB-kamera och IMU. NFA har över 5000 drifttimmar med 7 permanent deployerade preserie-enheter i Norden, Nordamerika och Australien. Företaget är backat av Sveaskog, Södra, Almi Invest, Navigare Ventures och Vinnova, och grundarteamet har PhD:er från WASP AI-programmet.;https://www.nordicforestryautomation.com/;https://www.ai-startups-europe.eu/assets/images/landscape/_180x180_letterbox_center-center_90_none_ffffff_ns/4471393/recJebw8somLu99bl.webp;https://www.ai-startups-europe.eu/p13?country%5B%5D=4000642;B2B, enterprise software;artificial intelligence, saas;Lund, Sweden;No
ON-IQ Solution AB;ON-IQ Solution är en partner inom computer vision och AI som hjälper företag bygga innovativa system och kreativa lösningar med state-of-the-art-teknologi. Företaget fokuserar på att vara en pålitlig teknologisk partner i AI-integreringsprocessen och erbjuder stöd samtidigt som de minimerar risker och osäkerheter. ON-IQ tillhandahåller workshops för learning-by-doing där kunder kan förstå och fatta tekniska och strategiska beslut för att gå vidare från sitt nuvarande utvecklingsstadium. Företaget erbjuder även produktutveckling av MVP (Minimum Viable Product) för att integrera och validera AI i processer, samt DevOps och integrationssjänster inklusive CI/CD pipelines och robusta säkerhetsåtgärder för cloud migration och skalbarhet. Med ett dedikerat team av experter och ett partnernätverk levererar ON-IQ kompetens för att förbättra organisationers effektivitet genom automation och computer vision. Bland deras kunder finns Gamecam, Skillfully och Aimap.;https://oniqvision.com/;https://www.ai-startups-europe.eu/assets/images/landscape/_180x180_letterbox_center-center_90_none_ffffff_ns/4472184/recq9ZQCkLZ97Fs4C.webp;https://www.ai-startups-europe.eu/p14?country%5B%5D=4000642;B2B, enterprise software;artificial intelligence;Lund, Sweden;No
PainDrainer AB;PainDrainer erbjuder en komplett Remote Therapeutic Monitoring (RTM)-lösning som kombinerar Paindrainer Care Portal med Paindrainer PD1-appen för personaliserad behandling och medicinhantering av kronisk smärta i en enda plattform. PD1 är en medicinteknisk produkt utvecklad i samarbete med ledande sjukhus och smärtspecialister i Skandinavien och USA. Den patenterade metoden har visat signifikant förbättring av livskvaliteten för patienter med kronisk smärta. Studier visar att 60% av användare med kronisk rygg- och nacksmärta upplever minskad smärta efter 12 veckors användning. Paindrainers unika 360-graders patientcentrerade koncept möjliggör fullständig personalisering för varje patient. Lösningen tillhandahåller värdefulla insikter genom RTM om hur patienters dagliga aktiviteter påverkar deras hälsa, vilket hjälper vårdpersonal att skapa anpassade vårdplaner. Paindrainer används av ledande sjukhus som New York Presbyterian Hospital och UC San Diego Health.;https://paindrainer.com;https://www.ai-startups-europe.eu/assets/images/landscape/_180x180_letterbox_center-center_90_none_ffffff_ns/4471113/rec9c7WyCV0hwckGM.webp;https://www.ai-startups-europe.eu/p15?country%5B%5D=4000642;B2B, health, medical devices;artificial intelligence, hardware, deep tech;Lund, Sweden;No
Parlametric AB;"Parlametric levererar AI-drivna rapporter baserade på kunddata - samtal, mejl, chattar, digitala ärenden och enkätsvar - för att kontinuerligt identifiera förbättringsområden, minska manuellt arbete och öka kundnöjdhet. Företaget erbjuder tre funktioner i samtalsanalys: överblick över alla ärenden via telefon, chatt och e-post med svar på varför kunder kontaktar, vilka ärenden tar längst tid och hur ofta samtal inleds trevligt; benchmark-jämförelse mot liknande företag i branschen; samt uppföljning av verksamhetsanpassade KPI:er över tid. För enkätundersökningar tillhandahåller Parlametric analys av öppna frågor med egenutvecklad AI-teknologi granskad av erfarna analytiker, realtidsuppföljning av insamling samt tydliga jämförelser mellan aktuella och tidigare undersökningar. Parlametric erbjuder även TEXTALIO för självanalys av data, SPEAKIN utvecklat i samarbete med skolor för att stärka barns språkfärdigheter, samt avancerad dokumentanalys. All data hanteras säkert enligt GDPR via företagets analysportal.";https://parlametric.com/;https://www.ai-startups-europe.eu/assets/images/landscape/_180x180_letterbox_center-center_90_none_ffffff_ns/4471859/recclLlBcMyT9jlol.webp;https://www.ai-startups-europe.eu/p15?country%5B%5D=4000642;B2B;artificial intelligence;Lund, Sweden;No
SiB Solutions AB;SiB Solutions möjliggör felfri logistik genom cutting edge-teknologi och artificiell intelligens (SiB står för Seeing is Believing). Företaget är ett logistikteknologiföretag som möjliggör felfri logistik över hela leveranskedjan. Deras Intelligent Video och AI Services ger omedelbart överlägsen synlighet samt visuell bevisning och insikter. SiB Solutions hjälper företag att uppnå lönsamma logistikprocesser man kan visa upp med stolthet. Genom att kombinera videoteknik med AI kan SiB Solutions identifiera problem i realtid, dokumentera händelser och ge handlingsbara insikter som förbättrar effektiviteten i supply chain management och distribution.;https://www.sibsolutions.com;https://www.ai-startups-europe.eu/assets/images/landscape/_180x180_letterbox_center-center_90_none_ffffff_ns/4471259/recFU1bCCjFZPpwG9.webp;https://www.ai-startups-europe.eu/p18?country%5B%5D=4000642;B2B;artificial intelligence;Lund, Sweden;No
Emulate Energy;Emulate Energy utvecklar next-generation energilagrings- och demand response-lösningar för smarta energisystem. Företagets teknologi kombinerar AI-driven lastprognostisering med distribuerad energiresurshantering för att balansera energinät och maximera förnybar energianvändning. Emulate erbjuder virtuella kraftverk som aggregerar batterier, elfordon och flexibel last för nättjänster. Lösningen används av nätoperatörer och energibolag för att stabilisera elnät med hög andel intermittent förnybar energi. Företaget driver transformationen mot ett flexibelt och hållbart energisystem genom deep tech-innovation.;https://www.emulate.energy/;https://www.ai-startups-europe.eu/assets/images/landscape/_180x180_letterbox_center-center_90_none_ffffff_ns/4471956/recgsoaFYurOR1BJa.webp;https://www.ai-startups-europe.eu/p6?country%5B%5D=4000642;B2B;deep tech;Lund, Sweden;No
Your Speech Factory;Your Speech Factory är en tech-startup i Malmö som förbättrar kommunikationsarbetsflöden genom AI-drivna verktyg för presentationsskapande och mötesberedning. Företaget erbjuder två distinkta produkter som delar samma mål: att eliminera repetitiva uppgifter från kommunikationsprocesser. Tjänsten kombinerar neurovetenskap med AI för att boosta mötesberedning och hjälpa användare skapa bättre presentationer som driver bättre affärsresultat. Plattformen inkluderar funktioner som Slide Style Analysis, audience-centric Slide Builder, Product Info Slide Builder, Financial Report Slide Builder och Slide Tag Management för att leverera rätt slides till rätt personer. Your Speech Factory arbetar med att analysera målgruppsanpassning och optimera presentationsinnehåll baserat på vem som ska ta emot informationen. Företagets lösningar används av organisationer som vill standardisera och effektivisera sin presentations- och kommunikationsproduktion.;https://www.yourspeechfactory.com/;https://www.ai-startups-europe.eu/assets/images/landscape/_180x180_letterbox_center-center_90_none_ffffff_ns/4471575/recQzn8An4jxm45Gw.webp;https://www.ai-startups-europe.eu/p21?country%5B%5D=4000642;B2B, enterprise software;artificial intelligence, saas;Malmö, Sweden;No
Oxide AB;Oxide utvecklar förklarbar AI (Explainable AI/XAI) för alla dataintensiva domäner med fokus på missionen att förstärka människor med pålitlig AI. Företaget erbjuder high-end AI-agenter för missionskritisk optimering genom sin Polychaos® API-plattform för att bygga och skala enterprise intelligence samt sin proprietära EvoQ™ unified AI-motor som är kapabel till kontinuerligt lärande, resonemang och anpassning i realtid. Oxide:s teknologi säkerställer precision med nolltolerans för hallucinationer, transparent förklaring av resultat från källdata till modeller, och anpassning inspirerad av evolution där system svarar på verklig feedback. Företagets Hybrid AI-approach uppnår stor flexibilitet och substansiella energibesparingar. Oxide levererar anpassade AI-agenter konfigurerbara för olika optimerings- och dataanalysscenarier, premium alternativ data-APIer med AI-raffinerad data för 6000+ publika företag, samt OXOGEN - en personlig investeringsanalysapplikation som demokratiserar AI-verktyg för objektiv forskning över hela finansmarknaden.;https://oxide.ai/;https://www.ai-startups-europe.eu/assets/images/landscape/_180x180_letterbox_center-center_90_none_ffffff_ns/4472197/recqbFpTSsUTiVlwc.webp;https://www.ai-startups-europe.eu/p15?country%5B%5D=4000642;B2B, energy;artificial intelligence, saas;Malmö, Sweden;No
Sanctify Financial Technologies AB;Sanctify hjälper organisationer att fatta bättre, hållbara beslut snabbare genom visibility in sustainability. Företaget tillhandahåller Sanctify ESG som samlar media från över 55 000 nyhetskällor världen över varje dag. Deras avancerade AI-system analyserar tusentals nyhetsartiklar dagligen och bearbetar data som skulle ta år för en människa att processa. Data presenteras på ett tydligt sätt som möjliggör effektivare analys och gör det enkelt att skapa och underhålla hållbara produkter, vilket sparar tid och pengar. Sanctify ESG scoring-systemet ger en översikt över hållbarhetsprestandan för alla företag i en portfölj och varnar när händelser inträffar. Systemet stödjer 13 000+ företag, använder 55 000+ källor och analyserar 8 miljarder datapunkter. Sanctify hjälper investerare att enkelt skapa hållbara investeringsprodukter, förbättra avkastning och hantera ESG-strategier till mycket lägre kostnad. Plattformen finns tillgänglig via webbapplikation, Bloomberg Terminal App, API och som gratis version (Sanctify ESG Open). Data distribueras även via Bloomberg och Neudata.;https://sanctify.ai;https://www.ai-startups-europe.eu/assets/images/landscape/_180x180_letterbox_center-center_90_none_ffffff_ns/4471241/recEwqyEbAzNOYGPs.webp;https://www.ai-startups-europe.eu/p17?country%5B%5D=4000642;B2B, enterprise software;artificial intelligence, saas;Malmö, Sweden;No
