name;description;website;image_url;source_page;market;type;Location;Greater Stockholm Y/N
Neurora.ai;Neurora.ai utvecklar en AI-driven sökmotor för chatbots och site-search. Företaget tillhandahåller intelligenta söklösningar som förbättrar användarupplevelsen genom att leverera relevanta och kontextuella svar. Neurora fokuserar på att göra sökning mer intuitiv och effektiv genom att använda avancerad AI-teknologi för att förstå användarnas intentioner och leverera precisa resultat i realtid.;https://neurora.ai;https://www.ai-startups-europe.eu/assets/images/landscape/_180x180_letterbox_center-center_90_none_ffffff_ns/4471600/recRvBNo3Re87tsgy.webp;https://www.ai-startups-europe.eu/p13?country%5B%5D=4000642;B2B, enterprise software;artificial intelligence;Stockholm, Sweden;Yes
Motorica;Motorica revolutionerar karaktärsanimation genom att generera rörelse med hjälp av AI till 99% lägre kostnad än traditionell MoCap. Företaget erbjuder instant AAA-animation där animatörer kan skapa professionell animation på sekunder med deras generativa AI mocap-aktör. Motorica kombinerar previs-hastighet med produktionskvalitet och tar bort tidskrävande och repetitiva uppgifter så att animatörer kan fokusera på kreativa aspekter. Plattformen erbjuder över 100 färdiga stilar att blanda och kombinera, samt möjlighet att skapa egna Style Clones med bara 10 minuters mocap-data. Motoricas Motion Factory gör det möjligt att generera kompletta gameplay-dataset på minuter, perfekt anpassade för Motion Matching och andra gameplay-animationssystem. Teknologin integreras direkt i 3D-scener via plugin eller API och används av kreativa skapare världen över från spelstudior som Quantic Dream till filmproduktion. Lösningen förvandlar veckor av arbete till minuter och minuter av animation till timmar.;https://www.motorica.ai/;https://www.ai-startups-europe.eu/assets/images/landscape/_180x180_letterbox_center-center_90_none_ffffff_ns/4470972/rec3FvEy5T7fGczJN.webp;https://www.ai-startups-europe.eu/p13?country%5B%5D=4000642;B2B, enterprise software;artificial intelligence, saas;Stockholm, Sweden;Yes
NorthStat AB;NorthStat utvecklar smartare prehospital vård med hjälp av datadrivna simuleringar. Företaget använder avancerad dataanalys och AI för att optimera ambulans- och akutsjukvård genom att simulera olika scenarier och förutsäga resursbehov. NorthStat hjälper sjukvårdsorganisationer att fatta bättre beslut om resursallokering, placering av ambulanser och bemanning för att förbättra responstider och vårdkvalitet. Lösningen är särskilt värdefull för att hantera varierande efterfrågan och optimera den prehospitala vårdkedjan.;https://home.northstat.se/;https://www.ai-startups-europe.eu/assets/images/landscape/_180x180_letterbox_center-center_90_none_ffffff_ns/4471486/recNMUmCmOs53qJnb.webp;https://www.ai-startups-europe.eu/p14?country%5B%5D=4000642;B2B, health;artificial intelligence;Stockholm, Sweden;Yes
NorthernLight Diagnostics AB;NorthernLight Diagnostics tillhandahåller beslutsstöd för vårdpersonal vid behandling med antidepressiva läkemedel. Företagets AI-lösning använder en medicinsk actigraf som patienten bär på handleden för att registrera rörelser under cirka en vecka. Systemet analyserar sedan aktivitetsmönster med innovativa grafiska displayer och kan estimera utfallet av flera olika antidepressiva behandlingsalternativ simultant - innan någon behandling har påbörjats. Detta ger vårdpersonal möjlighet att välja den mest effektiva behandlingen för varje enskild patient från början, vilket kan minska prövotiden med olika mediciner och snabbare leda till bättre behandlingsresultat. NorthernLight kombinerar mental hälsovård med AI-teknologi för att förbättra behandlingsutfall och patienters livskvalitet.;https://nldx.se;https://www.ai-startups-europe.eu/assets/images/landscape/_180x180_letterbox_center-center_90_none_ffffff_ns/4472090/recm0LGwGnhMojbfl.webp;https://www.ai-startups-europe.eu/p14?country%5B%5D=4000642;B2B, health, pharmaceutical;artificial intelligence, deep tech;Stockholm, Sweden;Yes
Normain;Normain är en AI-plattform för strukturerat kunskapsarbete i dokument och kalkylblad som inte kräver något tech-team. Företaget erbjuder AI-agenter för professionella tjänster inom revision, compliance och hållbarhet med fokus på att spara över 80% av tid och kostnad. Plattformen använder templates för olika användningsfall som M&A Due Diligence, Audit, Digital Maturity Assessment, Risk Assessment, RFP Review, CSRD Gap Analysis och DORA Gap Analysis. Normain möjliggör noll processförändring och låter användare enkelt lägga till sin expertis, inspektera källor och ge feedback. Företaget värdesätts till 4 MEUR sex månader efter lansering och har uppmärksammats av Creandum som ett av 12 startups att bevaka. Normain samarbetar med företag som Advisense, 2050 Consulting och Shortcut MedTech för att AI-driva compliance och CE-märkning. Plattformen erbjuder enterprise-level datasäkerhet i varje steg och kan deployas natively i kundens Azure-miljö. Sven Törnkvist från EQT är styrelseordförande.;https://normain.com/;https://www.ai-startups-europe.eu/assets/images/landscape/_180x180_letterbox_center-center_90_none_ffffff_ns/4472121/recnhMirdK35cKE7t.webp;https://www.ai-startups-europe.eu/p14?country%5B%5D=4000642;B2B, edtech & e-learning;artificial intelligence, saas;Stockholm, Sweden;Yes
Norna AB;Norna är ett svenskt AI-företag med ett talangfullt team på 30 personer från 8 nationaliteter med erfarenhet från HP, Ericsson, Aifloo och Tobii. Teamet består av dedicerade AI-forskare, designers, produktchefer och AI-ingenjörer med missionen att revolutionera retailbranschen. Företaget utvecklar AI-lösningar specifikt för modehandeln och arbetar med fashion data revolution. Norna har ingått partnerskap med CGI, den kanadensiska multinationella teknologikonsultfirman, för att accelerera utvecklingen och implementeringen av sina AI-lösningar i retailsektorn. Företaget fokuserar på att hjälpa modeföretag att fatta bättre beslut genom avancerad dataanalys och AI-driven insikter.;https://norna.ai;https://www.ai-startups-europe.eu/assets/images/landscape/_180x180_letterbox_center-center_90_none_ffffff_ns/4471783/recaAXEqAmyV8OrcJ.webp;https://www.ai-startups-europe.eu/p14?country%5B%5D=4000642;B2B, enterprise software;artificial intelligence;Stockholm, Sweden;Yes
OrganAi.se;OrganAi organiserar människors liv genom AI-driven personlig assistans och livsstilsoptimering. Företagets lösning använder artificiell intelligens för att hantera kalender, uppgifter, påminnelser och dagliga rutiner automatiskt. OrganAi lär sig användares preferenser och beteenden för att proaktivt föreslå optimeringar och minska mental belastning. Plattformen integrerar med befintliga produktivitetsverktyg och agerar som en intelligent koordinator för privatlivet. Genom att tillämpa AI på personlig organisation frigör OrganAi tid och mental energi för användare att fokusera på det som betyder mest.;https://organai.se/;https://www.ai-startups-europe.eu/assets/images/landscape/_180x180_letterbox_center-center_90_none_ffffff_ns/4470988/rec3z978kDrZKDlpR.webp;https://www.ai-startups-europe.eu/p14?country%5B%5D=4000642;B2B;artificial intelligence;Stockholm, Sweden;Yes
Nrlyze AB;Nrlyze optimerar energiflödet och förbättrar effektiviteten i fastigheter genom att analysera, identifiera och korrigera felaktiga inställningar och obalans i värmesystem. Företagets AI-baserade algoritmer kan minska fastigheters uppvärmningskostnader och CO2-avtryck med upp till 20%. Nrlyze hjälper fastighetsägare hela vägen med insikter och åtgärder för att maximera energieffektivisering. Systemet garanterar minskade värmekostnader med minimal insats från fastighetsägaren. Tjänsten inkluderar automatisk övervakning och optimering av värmesystem för att säkerställa att fastigheterna värms upp på det mest kostnadseffektiva sättet. Bland Nrlyze kunder finns Qsec, ByggVesta, Mariehus, HRE-huset, Torsby kommun och olika universitetsbyggnader. Företaget fokuserar på att göra fastighetsförvaltning mer hållbar och ekonomiskt effektiv genom smart energihantering.;https://www.nrlyze.se;https://www.ai-startups-europe.eu/assets/images/landscape/_180x180_letterbox_center-center_90_none_ffffff_ns/4471567/recQX9bx52YfzYTrZ.webp;https://www.ai-startups-europe.eu/p14?country%5B%5D=4000642;B2B, energy, real estate;artificial intelligence;Stockholm, Sweden;Yes
Omnimodular AB;Omnimodular är en white-label-leverantör av automatiserad fakturahantering genom maskininlärning, primärt för Fintech-företag. Företaget utvecklar AI-lösningar som tolkar fakturor, parar ihop dem med inköpsordrar samt skapar konterings- och attestantförslag. Omnimodular hostar lösningen på en in-house byggd ML serving-plattform som enkelt integreras med kundens befintliga WMS/ERP-system oavsett leverantör utan att påverka invanda gränssnitt eller arbetsflöden. Deras SaaS-lösning automatiserar arbetsflöden, sparar tid och minskar risken för felhantering i fakturahanteringen. Kunder rapporterar att AI-lösningen sparar enormt med tid jämfört med hur de jobbade tidigare. Omnimodular erbjuder en konkurrenskraftig konsumtionsbaserad prismodell som låter kunder skala upp AI-funktionaliteten i takt med att användningen ökar. Företaget fokuserar på partnersuccess, minskad risk genom att stå för utveckling och drift, förkortade ledtider till kund och tillhandahåller kontinuerligt uppdaterad teknisk expertis.;https://www.omnimodular.com;https://www.ai-startups-europe.eu/assets/images/landscape/_180x180_letterbox_center-center_90_none_ffffff_ns/4472374/recxZkiqQXikqMqr2.webp;https://www.ai-startups-europe.eu/p14?country%5B%5D=4000642;B2B, fintech;artificial intelligence, machine learning, saas;Stockholm, Sweden;Yes
Parsd AB;Parsd är ett smart digitalt bibliotek som transformerar hur team konverterar komplex information till handlingsbara insikter genom att kombinera AI:s hastighet med rigorös källverifiering. Plattformen gör det möjligt att ladda upp dokument, webbsidor eller audio och bearbeta hundratals dokument samtidigt medan Parsd:s AI extraherar nyckelinsikter på minuter. Användare kan betygssätta och organisera källor för att bygga en forskningsbas som står upp för granskning. Systemet kan samla hundratals dokument i projekt och chatta med alla samtidigt för att avslöja dolda kopplingar, med förinställda format för rapporter, presentationer eller sociala medier. Parsd riktar sig till forskare, undersökande journalister, future studies-professionals, policyskribenter, akademiska studenter, marknadsforskare, geopolitiska riskanalytiker, venture capitalists och staff officers. Plattformen stöder multispråkig dokumentanalys, översättning av hela dokument, och erbjuder source management med användarrating. Parsd används av Stockholm Stad, Swedish Defence University, WASP och är backat av Sting och Propel Capital.;https://parsd.com;https://www.ai-startups-europe.eu/assets/images/landscape/_180x180_letterbox_center-center_90_none_ffffff_ns/4471830/recbuXz5Lvzsq7hlU.webp;https://www.ai-startups-europe.eu/p15?country%5B%5D=4000642;B2B, enterprise software;artificial intelligence, saas;Stockholm, Sweden;Yes
Recap Power;Recap Power skapar innovativa smarta energi- och smarta laddningslösningar som möjliggör övergången till ett fossilfritt samhälle. Företaget tillhandahåller både programvara och batterier as-a-service och löser kapacitetsproblem i fastigheter, för fordonsladdning och hela elnät. Recap Power erbjuder aggregatortjänster, löser kapacitetsproblem och tillhandahåller smart styrning av batterier, elfordonsladdare och lokal energiproduktion. Företagets unikt egenutvecklade energistyrningssystem Nebula kan optimera användandet av batterier för att stödja lokala kapacitetsbehov, hantera peak-shaving, erbjuda spotprisoptimering samt skapa intäkter från flexibilitets- och stödtjänster som erbjuds till lokala energibolag (DSO:er) och Svenska Kraftnäts stödtjänstmarknader. Systemet minskar kapacitetsbehov och möjliggör energibesparingar genom att optimera uttag från elnätet och maximera nyttan av lokalt producerad energi i kombination med batterisystem. Nebula är designat för att vara skalbart och enkelt att integrera med externa plattformar.;https://power.recapenergy.com/;https://www.ai-startups-europe.eu/assets/images/landscape/_180x180_letterbox_center-center_90_none_ffffff_ns/4470979/rec3ZtX0wifnC5GV5.webp;https://www.ai-startups-europe.eu/p16?country%5B%5D=4000642;B2B, B2C, energy, transportation;saas;Stockholm, Sweden;Yes
Racefox AB;Racefox är din personliga AI-coach som spårar din rörelse och ansträngning i realtid. Coachen hjälper dig att gå längre och snabbare samtidigt som du hålls skadesfri genom att ge IRL-feedback medan du tränar. Racefox använder avancerad rörelsespårning och AI för att analysera din löpstil, teknik och ansträngningsnivå, vilket möjliggör personaliserad coaching baserad på din individuella prestation. Lösningen är särskilt användbar för löpare som vill förbättra sin teknik och prestanda samtidigt som de minimerar skaderisken genom datadrivet beslutsstöd.;https://racefox.com/sv/home;https://www.ai-startups-europe.eu/assets/images/landscape/_180x180_letterbox_center-center_90_none_ffffff_ns/4471558/recPtDsa7aiDzpFAz.webp;https://www.ai-startups-europe.eu/p16?country%5B%5D=4000642;B2B, enterprise software;artificial intelligence;Stockholm, Sweden;Yes
rek.ai;rek.ai transformerar statiska webbplatser till användarvänliga personaliserade upplevelser. Företagets vision är att varje webbplats ska ha AI-förbättrad navigering för att hjälpa användare hitta vad de söker. Detta ger bättre användarupplevelse, snabbare tillgång till information för besökare, sparar tid för webbansvariga och minskar behovet av teknisk support. rek.ai sorterar, personaliserar och förbättrar användarupplevelsen på webbplatser med stora mängder data och undersidor, vilket resulterar i lägre bounce rate och exit rate. Efter EU:s Schrems II-avgörande och GDPR har mycket förändrats kring databehandling. rek.ai:s koncept är att personalisera webbplatser baserat på kollektivt användarbeteende snarare än individuella data, vilket gör tjänsten mycket framtidssäker. rek.ai lagrar aldrig IP-nummer eller identifierare och är byggd oberoende av cookies. Företaget används av kommuner som Halmstad och uppnår hög kundnöjdhet genom att spara tid för kommunikationsresurser.;https://rek.ai;https://www.ai-startups-europe.eu/assets/images/landscape/_180x180_letterbox_center-center_90_none_ffffff_ns/4471943/recgHp0Lx0VedMgVH.webp;https://www.ai-startups-europe.eu/p16?country%5B%5D=4000642;B2B;artificial intelligence;Stockholm, Sweden;Yes
ProptechCore;ProptechCore accelererar dekarbonisering av den byggda miljön genom sitt Sustainability Operating System. Företaget tillhandahåller skalbar och kostnadseffektiv energioptimering och dekarboniseringslösning genom sin decarbAI-plattform som optimerar och dekarboniserar många typer av energikonsumenter och alla typer av byggnader oavsett ålder och typ av energisystem, kontrollsystem, sensorer, BMS, SCADA eller PLC. Deras optimerings-AI förbättrar prestanda 24×7 året runt och byggnader blir smarta energikonsumenter som är adaptiva till nät/energi, med möjlighet att inkludera energiproducent och/eller distributör för att balansera/hantera toppar och priser. ProptechCore är Microsoft Start-up och Nvidia Inception partner, SmartScore & WiredScore Accredited partner, och har vunnit pris för mest innovativa digital twin vid Autodesk University samt varit finalist i Impact Awards Europe och Proptech Awards Europe. Företaget är medlem i EU Smart Readiness Workgroup 3 och finns med på Europe Trusted AI startup map.;https://www.proptechcore.com/;https://www.ai-startups-europe.eu/assets/images/landscape/_180x180_letterbox_center-center_90_none_ffffff_ns/4472361/recxDx2RkmmhmdtAA.webp;https://www.ai-startups-europe.eu/p16?country%5B%5D=4000642;B2B, B2C, energy;artificial intelligence, saas;Stockholm, Sweden;Yes
Rider’s Position Sweden AB;Rider's Position är världens första digitala realtidstränare för ridsportutövare som ger omedelbar feedback på ryttarens teknik och position. Företagets system använder sensorer och AI-analys för att mäta ryttarens sits, balans och kommunikation med hästen i realtid. Genom visuell och haptisk feedback hjälper tekniken ryttare att förbättra sin teknik och prestanda utan behov av konstant instruktör. Rider's Position riktar sig till både hobbyryttare och professionella tävlingsryttare som vill utvecklas snabbare. Företaget kombinerar sport science med wearable technology för att demokratisera tillgången till högkvalitativ ridträning.;https://ridersposition.com;https://www.ai-startups-europe.eu/assets/images/landscape/_180x180_letterbox_center-center_90_none_ffffff_ns/4471017/rec5Rxngj6cm0kiGJ.webp;https://www.ai-startups-europe.eu/p17?country%5B%5D=4000642;B2B;deep tech;Stockholm, Sweden;Yes
SALUTO (Inference Labs AB);SALUTO är din digitala hälsoguide drivna av förklarbar AI (eXplainable AI). Tjänsten förvandlar blodprov, kroppsmått och andra hälsodata till personliga insikter med kontinuerligt livsstilsstöd. SALUTO:s AI möjliggör en samlad bedömning av hälsodata som är mer individualiserad än traditionella metoder, vilket ger bättre förmåga att upptäcka hälsorisker, bevaka utvecklingen över tiden och förstå vilka livsstilsförändringar som har bäst förutsättningar att förbättra hälsan. Plattformen samlar all hälsodata på ett ställe med AI-drivna hälsoinsikter, livsstilsbedömningar och rekommendationer med uppföljningar över tiden. Användare kan enkelt koppla upp sina mobila hälsodata genom mobilappen som finns tillgänglig på både App Store och Google Play. SALUTO fokuserar på att ge användare verktyg för proaktiv hälsohantering genom datadrivna personliga rekommendationer.;https://www.saluto.ai;https://www.ai-startups-europe.eu/assets/images/landscape/_180x180_letterbox_center-center_90_none_ffffff_ns/4472258/rectLnbimhPSKceSe.webp;https://www.ai-startups-europe.eu/p17?country%5B%5D=4000642;B2C, enterprise software;artificial intelligence, saas;Stockholm, Sweden;Yes
Sana Labs;Sana Labs är på uppdrag att tillhandahålla personaliserad utbildning för alla, överallt. Företaget är ett AI-företag som banbryter nästa generation av kunskapsverktyg som är betrodda av innovatörer och marknadsledare. Sana erbjuder två huvudprodukter: Sana Agents (AI-agenter för varje team) och Sana Learn (AI-native lärandeplattform). Sana har nyligen co-lanserat Swedish AI Reform för att ta agentic AI till 2,3 miljoner svenskar över offentlig sektor, skolor och ideella organisationer. Företaget arbetar med att demokratisera tillgången till avancerad AI-driven utbildning och kunskapsdelning genom att göra kraftfulla lärandeverktyg tillgängliga för organisationer av alla storlekar. Sana:s plattform använder AI för att personalisera lärandeupplevelser och optimera kunskapsöverföring i organisationer.;https://www.sanalabs.com/;https://www.ai-startups-europe.eu/assets/images/landscape/_180x180_letterbox_center-center_90_none_ffffff_ns/4471816/recbVpJrkhe3ehbp0.webp;https://www.ai-startups-europe.eu/p17?country%5B%5D=4000642;B2B, edtech & e-learning;artificial intelligence, saas;Stockholm, Sweden;Yes
Seber Medical;Seber Medical har utvecklat SeeWound, en applikation för automatisk övervakning av sårläkning direkt vid vårdpunkten. SeeWound är en lättanvänd mobilapplikation (iOS/Android) driven av branschledande artificiell intelligens som förbättrar behandling och förbättrar samarbete mellan vårdenheter genom informationsdriven och resultatbaserad sårläkning. Systemet är CE-märkt och klassas som medicinteknisk produkt. SeeWound förbättrar sårbehandlingar med upp till 20% minskad läkningstid genom tidig upptäckt av icke-fungerande behandlingar. Lösningen ökar patientengagemang genom daglig kommunikation om exakt sårläkningsbana och förbättrar kommunikation mellan kollegor genom objektiv dokumentation. SeeWound används av över 50 kliniker, primärvårdsenheter och kommunala vårdfaciliteter i Sverige från regioner som Östergötland, Sörmland, Kronoberg, Värmland, Västernorrland, Västmanland, Gotland och Stockholm. Företaget har en vetenskaplig styrelse med ledande experter inom sårvård och har rankats som topp 5 bästa hälsoappar i Norden.;https://www.sebermedical.com/;https://www.ai-startups-europe.eu/assets/images/landscape/_180x180_letterbox_center-center_90_none_ffffff_ns/4470981/rec3doT1YzNYKqSOs.webp;https://www.ai-startups-europe.eu/p17?country%5B%5D=4000642;B2B, health, medical devices, food;artificial intelligence, hardware, deep tech;Stockholm, Sweden;Yes
Sift Lab;Sift Lab hjälper retail och e-handel att optimera försäljningskampanjer genom att låsa upp kraften i data med data-centric AI. Företaget har lanserat Sift Story, deras senaste plattformsversion som tar AI-baserad analys, målgrupper och dataprestanda till en helt ny nivå. De introducerar även sin AI-agent Sift Sense, där användare är en prompt bort från att förstå sina kunder, automatisera targeting och optimera beslutsfattande. Sift Labs next-gen AI-plattform gör det möjligt att förutsäga och optimera verksamheten genom att gå från insikt till idé till handling snabbare. Plattformen ger värdefulla insikter över nyckelområden som Sales, CRM, Marketing, Product och Supplier/Inventory management genom interaktiva dashboards. AI-segmentering används för att optimera kampanjmålgrupper över flera kanaler inklusive Email, SMS, Meta, Google och TikTok. Sift Lab arbetar med Nordic Nest Group och andra skandinaviska retailers för att ta datadrivna beslut och öka intäkter över CRM, betalda kanaler och produktutveckling.;https://siftlab.com;https://www.ai-startups-europe.eu/assets/images/landscape/_180x180_letterbox_center-center_90_none_ffffff_ns/4472146/recoTpZvJtMLAEdtm.webp;https://www.ai-startups-europe.eu/p18?country%5B%5D=4000642;B2B, ecommerce;artificial intelligence, saas;Stockholm, Sweden;Yes
Semsomi AB;Semsomi (Monok) är en plattform för artificiell intelligens-genererade nyhetsartiklar. Tjänsten skriver, applicerar multimedia och genererar videos från ett enda sökord. Semsomi automatiserar hela processen från innehållsskapande till publicering, vilket gör det möjligt att snabbt producera nyhetsmaterial och journalistiskt innehåll i stor skala. Lösningen är särskilt användbar för medieföretag och publishers som behöver producera stora mängder innehåll effektivt.;https://www.monok.com/en;https://www.ai-startups-europe.eu/assets/images/landscape/_180x180_letterbox_center-center_90_none_ffffff_ns/4471854/recch405JfFPV1qcI.webp;https://www.ai-startups-europe.eu/p18?country%5B%5D=4000642;B2B, enterprise software;artificial intelligence, saas;Stockholm, Sweden;Yes
Semanttic;Semanttic är en AI Copilot för UX Prototyping som hjälper designers och utvecklare att snabbare skapa användargränssnitt och prototyper. Företaget fokuserar på att använda AI för att accelerera designprocessen och göra det enklare att iterera på UX-lösningar. Semanttic riktar sig mot crossfunktionella team inom forskning och utveckling som vill förkorta tiden från idé till prototyp och förbättra samarbetet mellan designers, utvecklare och produktchefer.;https://www.semanttic.com;https://www.ai-startups-europe.eu/assets/images/landscape/_180x180_letterbox_center-center_90_none_ffffff_ns/4471833/recbvpgMn4VKlkIfn.webp;https://www.ai-startups-europe.eu/p18?country%5B%5D=4000642;B2B, enterprise software;artificial intelligence;Stockholm, Sweden;Yes
Skrym;Skrym hjälper onlinehandlare att sluta skicka luft genom att erbjuda en verktygslåda för att perfektera logistiken. Företaget tillhandahåller effektiva verktyg för att hjälpa företag återta kontrollen över sina logistikoperationer. Med anpassningsbara standalone API:er betalar kunder endast för de funktioner de faktiskt behöver. Skrym erbjuder en Command Bar för att omedelbart hitta all relevant order- och sändningsinformation utan att behöva logga in på olika fraktförmedlarportaler. Plattformen är API-first med all funktionalitet tillgänglig som standalone API:er för integration med vilket system som helst. Lösningen är modulär så användare kan använda ett API eller kombinera all funktionalitet på nya och intressanta sätt. Skrym förbättrar marginaler genom att automatiskt spåra fraktkostnadsmarginaler för varje order, ökar lojalitet och minskar kundsupportbelastning med fullt anpassade ordersupplevelser, samt skapar checkout-strategier som pre-validerar exakta kostnader och leveranstider för varje order. Företaget arbetar med marknadsledande retail och e-handelsföretag för att skapa mer effektiva och hållbara logistikflöden.;https://www.skrym.se;https://www.ai-startups-europe.eu/assets/images/landscape/_180x180_letterbox_center-center_90_none_ffffff_ns/4470969/rec3DFJdthO5BncUx.webp;https://www.ai-startups-europe.eu/p18?country%5B%5D=4000642;B2B, ecommerce, transportation;saas;Stockholm, Sweden;Yes
